3461,yumi ko jump in surprise as the fire shoot upwards into the air and explode catch off guard wo ah PRON have 
3463,oh yeah PRON ipod almost explode last night i be use PRON while charge and shit be spark ak xb sk dn almost die
3464,the exploded bean the bastard
3465,date meet sex hot teen as s explode by fat cock
3466,news science london warship explode in because sailor be recycle artillery cartridge life tech
3467,hah aha great song spend year get loaded year till PRON liver explode now what s bob go to do now that PRON
3468,work at a fast food joint pour burn hot oil down the sink PRON hit the water in the trap and explode worst summer job
3469,new explosion proof temper glass screen protector film for blackberry z full read by 
3470,ee recall power bar phone charger after explosion burn woman the register
3471,another mechanical mod explosion man injure when a pharaoh mod blow up in PRON hand
3472,report corey brewer be drug test after point explosion
3473,young dancer move about youth in attendance at the gm mbc youth explosion this past saturday inspiring
3474,around injure in explosion in chemical park in western germany
3475,i like a video huge building explosion at fps the slow mo guy
3476,large explosion rock aluminum plant in southeast missouri re naomi no logo
3477,do not think PRON have ever be this close to a mental explosion in so long
3478,ga elite explosion greg top rd out ball strike no one on p morgan orchard b
3479,PRON a tie dye explosion on ig help PRON PRON be drown in tie dye
3480,explore new world three moment of an explosion by china mie ville 
3481,more g tosh a officer on site investigate nor and a explosion kf vs news cape girard eau carbondale poplar bluff
3482,a time lapse map of every nuclear explosion since by isao hashimoto war atomic bomb
3483,let get a dope picture together and have the dop explosion
3484,big datum and social information explosion the union that could evolve PRON retail strategy hua
3485,aspire musician amp song writer share PRON talent at the gm mbc youth explosion on this past saturday
3486,i hope PRON do and i hope PRON die in the explosion too
3487,a pyrotechnic artwork by cai guo qiang explode into a blossom on the step of the philadelphia
3488,mencius tear be bad correct take the explosion n more pain day to day right
3489,that s always good for a pretty explosion
3491,ee recall power bar battery pack after explosion in student bedroom
3492,cum explosion
3493,saddle with accountable information explosion tip pro preferable financial top brass taw fm caw
3496,do PRON miss the bitcoin explosion do not miss out hangout tonight at pm est gt gt gt
3497,kinder morgan gas explosion
3498,tampa super freestyle explosion live in concert at amalie arena sep ticket info
3499,PRON find a sunflower explosion on PRON walk 
3500,be in a bad as s mood today get on the elevator at school and decide to make explosion nose everytime some one press a button
3501,checkout all the nurgle rule amp feature that snuck in on k hr one wd 
3503,PRON be invite to the expo explosion summer event when august th friday where ben e keith
3504,the gusto in persist have amongst empty pate communication explosion hp s s jd
3505,the inside of the explosion box get PRON customize the way PRON want d cube crafts greeting card
3506,for those that be interested in the gun powder art discuss at the end of introduction to theological aesthetic
3507,the government be concern about the population explosion and the population be concerned about the government explosion joe moore
3508,remember pittsburgh eyewitness history of steel city by len bar cou sky pb penn 
3509,i be an eyewitness ha
3510,eyewitness identification via reddit 
3511,w pri eyewitness news rhode island set to modernize PRON voting equipment w pri eyewitness
3512,eyewitness account of survivor of hiroshima glean from a number of oral history project
3513,dutch crane collapse demolish house dramatic eyewitness video capture the moment a dutch crane hoist
3514,eyewitness media be actively embrace by uk audience read the report by on the impact of ugc in news
3515,read an eyewitness account from hiroshima from this day in life
3516,interesting approach but do not replace eyewitness video the ferguson case video
3517,climate change eyewitness to extreme weather social medium post that show just how crazy thing a anarchy
3518,hamburg police chief gregory wicket t have tell eyewitness news PRON can not confirm or deny an investigation be underway
3519,i like a video mini pony pack a punch live report from the salem county fair on cbs eyewitness
3520,lone survivor the eyewitness account of operation red wing and the lost hero of seal team 
3521,the civil rights movement eyewitness history series wexler sanford hardcover 
3522,how little boy affect the people in hiroshima eyewitness testimonial
3523,read a schoolboys eyewitness account of hiroshima
3525,w f tv eyewitness news tn school psychologist arrest in florida on child porn charge
3526,wake up kern county eyewitness news morning air right now on k bak cbs live on k bak
3527,on anniversary of hiroshima bombing illustrate timeline of bombing eyewitness account particularly horrify
3528,aug radio show article eyewitness account of abortion organ harvesting by planned parenthood
3529,dk eyewitness travel guide denmark travel guide ebay auction PRON should keep an eye on
3531,rt patrick j butler excellent damien gay le eyewitness account of kid company closure PRON drop the bomb and expect
3532,monkey abuse by notorious laboratory dealer a peta eyewitness invest via
3533,a true t bt eyewitness news wb re w you
3534,dk eyewitness travel guide chicago by dorl e kinder s ley publish staff travel book ebay auction PRON s
3535,PRON light out again with stage two load shed stage two load shedding will be in force between pm and pm
3537,w f tv eyewitness news fbi man who steal PRON secret marry honduran minor for sex
3538,free boko haram captive speak up i will make sure PRON go to school
3539,i try to save mi do mac i a one of the murder accuse have testify PRON try to save mi do mac i as life
3540,russian food crematoria provoke outrage amid crisis famine memory moscow reuters russian government 
3541,guy these bitch be not famine then
3542,food crematoria provoke outrage amid crisis famine memory
3543,russia food crematoria provoke outrage in country w so are poverty soviet famine memory 
3544,hunger hit PRON and i can not function probably would not last long in famine zones thank god
3545,accord to a gallup poll the more money PRON have the more likely PRON be to suffer from time famine ari
3546,ppl like unu feast today and famine tomorrow
3547,top turn on the darkness king redeem queen serene famine wolf
3548,russian food crematoria provoke outrage amid crisis famine memory
3549,re PRON example low food price cause farmer to go broke famine next year mean simple capitalism fail to feed people gt
3550,a memorial to the million who perish in the holodomor have be erect in the us capital 
3551,export food will not solve the problem african will end famine n poverty by solve out of control tribal war
3553,new article russian food crematoria provoke outrage amid crisis famine memory read more at here
3554,building muscle with feast and famine feed most diet plan be base around lose weight but what should PRON
3555,the famine be come to an end bluebell
3556,PRON taste like a feast after a famine and PRON be starve trust jack i art g rw a tw rw rr bc
3558,russia destroy food while people go hungry be not the only one with an insane government
3559,ethiopian regime continue receive foreign aid when famine strike for year eastern ethiopia
3560,reuters russian food crematoria provoke outrage amid crisis famine memory 
3561,a grade in black horse famine mega score 
3562,russian food crematoria provoke outrage amid crisis famine memo rie
3563,bolshevik government monopolize food supply to seize power over hun h ry population artificial famine be the result
3564,russian food crematoria provoke outrage amid crisis famine memory via
3565,PRON have experience the smell of rot potato for the first time the famine must have be awful if the whole country smell like that
3567,when thing become terrible more than the great ethiopian famine
3568,remind PRON when the peasant destroy PRON food when stalin army come to redistribute the wealth PRON cause famine death
3569,update russian food crematoria provoke outrage amid crisis famine memory russian society still re cal
3570,the adventure of mine ness the famine be over
3571,food crematoria in russia provoke outrage amid crisis famine memory
3572,robert conquest famine museum kiev
3574,the end of time be upon us famine war death plague the presence be grow strong
3575,maratha raider scorch PRON land amp punjab refuse PRON food aid during the famine wonder if bengali harbor some hard feeling
3576,image of famine hope in christ a blog on what happen when PRON forget god hope in christ
3577,i squeeze a tear famine plague tsunami no chance lego blubber
3578,russian food crematoria provoke outrage amid crisis famine memory yahoo news
3579,year old boy charge with manslaughter of toddler report an year old boy have be charge with manslaughter over the fatal sh
3580,roger goodell s fatal mistake tom brady an innocent man
3581,boy charge with manslaughter in shoot death of elijah walker the year old appear wednesday in a
3582,fatal attraction be common n what PRON have common be pain
3583,a pd investigate fatal shooting of year old child in southeast anchorage
3584,investigator shift focus to cause of fatal waimate fire
3585,PRON be sorry but PRON be out
3586,police man in PRON early s die after shoot on vermont st 
3587,man accuse in fatal hit and run to get new judge via
3588,winnipeg police seek witness in arlington and william fatal crash
3589,nearly fatal pee in san francisco
3591,petition to remaster fatal frame with a wind waker style self ie mode
3593,man charge over fatal crash near dubbo refuse bail via
3594,california man face manslaughter charge in sundays wrong way fatal crash in ca
3595,the five fatal flaw in the iran deal via
3596,stockton police be investigate a fatal drive by shooting in north stockton
3597,deputy dog dispute lead to fatal shooting in person county gun fail nra
3599,ca cop illegal immigrant with prior arrest charge in fatal sex attack
3600,i be okay thank PRON yes PRON kindness be fatal though PRON like patrick stump level kindness
3602,success be not permanent amp failure be not fatal
3606,tell PRON why or why not to adopt in this way maybe i overlook something fatal for me why or why not
3607,boy charge with manslaughter in shoot death of elijah walker
3608,robert ball ews log statement be always at the fatal level
3609,fatal attraction
3610,news crime police PRON would victim in fatal crash that close i near franklin one person be d justice court
3613,boy charge in fatal shooting of year old
3617,exclusive in fatality involve on duty nypd cop in year only
3618,nyc news legionnaires death toll rise to in new york city all eight fatality be of old adult with
3619,let fraction the vital need for PRON fatality how would PRON break PRON down in education eco nom
3620,las vegas in top city for red light running fatality news lv
3621,PRON be totally unprepared for an emp attack both china russia and probably is is possess PRON fatality why be PRON push PRON
3622,city implore motorist not to speed after more report of animal fatality near nature reserve sgt
3623,who say ve g and fruit be good for PRON hope there s be no injury or fatality
3624,understand that there be no fatality as no one be trap inside the wholesale market fire engine and fire fighter on scene
3625,as of the month mark there be a total of fatality more than the first half of last year 
3626,hse release annual workplace facility datum have a look
3627,seattle deadliest red light runner intersection reveal
3628,reject mortal kombat fatality mortal kombat have stretch the boundary of PRON 
3629,minor train leave rail major smithsonian interlock derail amp crash into barrier wall w fatality
3630,injury illness and fatality late number 
3631,osage beach release name
3632,i wonder how cool weird PRON will look to have all the character in mk x do fatality on skinless predator
3633,saudi arabia a bha fatality report follow suicide bombing at mosque avoid area
3634,use PRON road wisely and prevent the carnage from continuing let PRON have no fatality over this holiday period gg in depend enc message
3635,mortal kombat fatality be so gross but interesting
3636,the x ray in mk x be look like fatality
3637,rt when PRON do not know how to do fatality in mortal kombat
3638,kit an a PRON fatality slay me kod y vine by 
3639,os p concern about mount fatality 
3640,mortal kombat x all fatality on meat predator
3641,estimate damage and fatality of an hiroshima sized atomic bomb drop on PRON hometown hiroshima
3642,the rcmp be report fatality and serious injury as a result of the collision on the tch near whitbourne
3643,govt allocating bn for flood action issue take centre stage after fatality in veneto
3644,there have be zero spider bite relate fatality in australia since
3645,i like a video tremor be no joke tremor dlc fatalities x ray
3646,motor dom lobby to change PRON language around traffic fatality PRON need to go back to the future vision zero
3647,share to help PRON cousin family
3648,among other main factor behind pedestrian fatality be people fail to yield to a car
3649,mortal kombat x be an excellent fatality and the most fun PRON have ever have with a mortal kombat sega s version
3650,uber reduce drunk driving fatality say independent study
3651,i like a video from mortal kombat x pc gameplay fatalities x rays mk x
3652,las vegas in top city for red light running fatality
3653,rcmp confirm fatality in two vehicle crash tch remain close at whitbourne due to accident
3654,american casualty include fatality and five to ten million japanese fatality
3655,no uk train accident fatality for th year run despite increase in passenger journey 
3656,i fail to see how that would not bring the number of road fatality down immensely
3657,policy lab be at last public hearing in nyc today and tomorrow to address child abuse and neglect fatality
3658,yep consider that million of japanese fatality be project for downfall 
3659,shipping logistic enc a fatality as migrant boat capsize in med with hundred onboard capsize as i
3660,message board will display update traffic fatality up from and new message begin today traffic death slow for worker
3661,driver fatality down on irish road but pedestrian and cyclist at more risk
3662,jay big l pun biggie wrap over zero question fatality flawless victory
3663,PRON be cuddle right now so
3664,yo dm PRON
3665,so these savage leak thomas brady gangster mail account and wonder why PRON be quick to fatality PRON samsung mobile b real son
3666,i like a video from s sn va bengal z s s vs sw s fatality captain falcon
3667,hibernate pb x irrespective of pitch fatality career is m pan cr bz f z
3668,fatality
3669,die of lyme disease case fatality rate nearly 
3670,when u do a fatality and like the corpse be still j it tere
3672,wow fatality on big rig hit motorcyclist blood everywhere wow PRON be sick
3673,nah PRON hit homie wit the fatality and then son d PRON wit the baba lit y cold cold as fuck lmfao o
3674,kosciusko police investigate pedestrian fatality hit by a train thursday
3676,yes life have a fatality rate
3677,how many basket do a charming fatality by get mystery paranormal
3678,PRON be make a bad boy and a must see
3679,need a team PRON need one
3680,afghan soldier kill PRON general americas highest ranke fatality since vietnam
3681,that usually never happen
3683,cat fatality utica ny pleasant amp holland ave black cat with white paw average size on grass next to north side of road
3685,j a x mk stage fatality u ud lk close
3686,see that there s a video of every fatality on mile ena make PRON sad
3690,fatality scary af probably not the good falcon but still scary
3692,truck crash on w at PRON in lebanon be a fatality very sad expect long delay through the morning
3693,yes apparently report of cow fatality as well sadly
3694,i like a video from mk x tremor stalag might fatality on er mac tournament pharaoh
3695,i add a video to a playlist s sw s fatality captain falcon vs snow fox ssb loser
3696,death of loretta fudd y responsible for authenticate obama birth certificate the sole fatality of nine on plane
3698,everyday be a near death fatality for PRON on the road thank god be on PRON side
3699,fear factory in december do deal
3700,i make a friend more interesting than all of PRON all combine
3701,the meaning i pick the one that change PRON life overcome fear behold wonder t cc catch the light endless
3702,sometimes PRON cheekiness bleed through PRON computer screen and i recoil in fear
3703,cause i know every man have a fear of a strong mind e woman but i say PRON s a keeper if PRON get PRON on PRON own and keep PRON runnin
3704,PRON big fear be disappoint the people who believe in PRON
3705,i do not want to hurt PRON but the fear drive PRON to do PRON midnight
3706,man fear the feeling of be control by a woman or passive aggressively be coerce into commitment before PRON be ready
3707,the thing PRON fear most in organizations fluctuation disturbance imbalances are the primary source of creativity margaret wheatley
3708,fear factory car official music video
3709,PRON all about understand um ntu wa kho if PRON do and trust PRON partner then y ok u will know and will not fear to do anything
3710,photo reference reference x ekstr in i think the nostril be eye and i almost cry from fear partake
3711,the fear of not look like PRON know what PRON be doing ahh that be a big one for PRON perry chat
3712,the opposite of love be fear here why
3713,fear
3714,help PRON win by have the most share on PRON article a lifetime of fear thank black in america growing up black
3715,PRON must refuse to become a nation with everyone live in fear of be shoot unaware by intoxicated amp or crazy people
3716,horror film be make by incredibly creative artist PRON interview of PRON in depth for the anatomy of fear
3717,i want to be with PRON forever stay by PRON side on this special night fear and loathing in las vegas solitude xmas
3718,PRON bad fear
3719,PRON be shake in fear PRON s go to hack the planet
3720,when the world say finish god say do not fear choose god restoring path
3721,by replace fear of the unknown with curiosity PRON open PRON up to
3722,love god more than PRON fear hell
3723,do not tell the bride give PRON the fear
3724,PRON be forfeit this year fantasy football pool out of fear i may win n get PRON as s kick
3725,as of right now PRON be reopen the x file that s what PRON fear the most the x files day
3726,live a balanced life balance PRON fear of allah with hope in PRON mercy and love for PRON
3727,PRON big fear be that eventually PRON will see PRON the way i see PRON
3728,couple have less sex for fear PRON will be a let down internet movie and book say how sex ought to be p
3729,nothing to fear PRON all about take risk
3730,untangle PRON from require PRON partner to fill PRON need and how to love without fear best talk radio listen
3731,the walk dead spin off fear the walk dead be on the rd
3732,i fear not for a while
3733,the fear of the lord be the start of knowledge but the foolish have no use for wisdom and teaching am sal
3734,the number of people deny climate change on the polar bear article make PRON fear for the future of the us but also humanity in general
3735,gd idea PRON be w rke hard now have almost nothing fear live with poor fran reed
3736,never let fear get in the way of achieve PRON dream delta children insta quote quote of the day disney walt disney
3737,fear be PRON motivator
3738,daily reflections august driven driven by a hundred form of fear self delusion self seeking and self pity
3739,morgan it e gemstone white fire opal sterling silver ring size r 
3740,marque i como vis to game of thrones kiss by fire banco de serie
3741,save the date saturday august be the salisbury fire department open house at cypress st be to
3742,why put out a fire when PRON still burn
3743,cause be on fire PRON be on fire be on fire now yeah be on fire PRON be on fire be on fire now w
3744,PRON avi and header combo be fire
3745,auction shoe retro fire red
3746,PRON asshole be on fire
3747,PRON be cry that song just end set PRON on fire
3748,set thing on fire be always an option
3749,s it around a fire sound great right about now
3750,i see fire
3751,but put flood of fire at the top of the list
3752,PRON be on fire
3753,polit if i act harry reid s percent of woman serve planned parenthood claim be a pant on fire lie t cot
3754,dear i bring PRON canon bring it fire canon tattoo mn there s more where that came from
3755,yeah just who PRON need another middle class hating republican out to get hard work cop fire fighter teacher
3756,this fire be way too close wtf be go on 
3757,fire meet gasoline always get to get play twice lol
3758,wcw th a bitch be fire
3759,well PRON feel like PRON be on fire
3760,PRON eye and word be so icy but PRON burn like rum on the fire
3761,news polit if i act harry reid s percent of woman serve planned parenthood claim be a pant on fire lie
3762,nothing like a good fire
3763,ten shi activate yuk is fire card
3764,california be shaking catch e on fire and overcharge ppl on rent for the past year PRON be not go nowhere
3765,there s a fire in the catalina s look kinda cool this picture do not do PRON justice
3766,do not overwork PRON PRON album be go to be fire just do not overwork or stress i love PRON take care
3767,i promise not to tax pancake or rainbow or not die in a fire
3768,this nigga cy hi diss be what meek be suppose to do this shit actually fire
3769,i wanna set some shit on fire
3770,in the word of charlie daniels fire on the mountain run boy run
3771,i just check in at on fire on love food
3772,when PRON heart be big than the obstacle in front of PRON euro dont expect no the july fire
3773,fire wave and darkness
3774,PRON may seem like PRON fire have be a little burn out
3775,smell a bon fire while driving make PRON wanna be s it near one make s more
3776,will be drop fire self ie tomorrow say PRON be welcome ahead of time
3777,fire call brant av drummond rd for fire structure single unit car on call truck
3778,PRON psa for the day if a fire truck be behind PRON with light go move over so PRON can get to PRON call
3779,rfp fire truck service body for f fire fighting rescue amp safety equipment transport a
3780,reno truck trailer catch fire in reno
3781,wild night in the village of pugwash every fire truck be out that the town have which be like a fire truck for every house population
3782,an wheeler come along and strike the fire truck spin PRON around degree and cause PRON to roll over
3783,sig alert update n close at f wy uf n trash truck fire
3784,do not look like a murder scene just cop a fire truck and fire assistance car along with a helicopter
3785,former township fire truck be use in philippines langley times philippines
3786,former township fire truck be use in philippines township of langley assistant fire chief pat walker s pen
3787,PRON garbage truck really catch on fire lmfao
3788,on north gate by the taco truck that s fire
3789,PRON never a good sign when PRON pull up to work amp there s five ambulance amp a fire truck in the bay wo mp p at least PRON friday
3790,fire truck and ambulance in k phase hope everyone okay pray for saipan
3791,sig alert north amp southbound close btw n f wy and irvine blvd due to truck fire chp be detour traffic
3792,true because of the truck that catch fire
3793,oh god xd i do not mean PRON so p but PRON have that fire truck in the back of PRON to make up for PRON so PRON good xd
3794,come across this fire video not mine enjoy babes way of say hi to PRON while PRON s in the fire truck fireman 
3795,n past the l lane be reopen all other lane be close all lane be open on the s trash truck fire cleanup
3797,find this cool photo not mine dodge wayne body window bus ex libby mt fire department truck all ori
3798,trident chevy fire truck w pump er ims fire dept red ho plastic 
3799,toddler bedding fire truck bundle fire truck firefighter sticker decal sign wall
3800,when a monster truck racer catch on fire at the fair
3801,truck fire clogs canyon road
3802,rg j truck trailer catch fire in reno
3803,philippines former township fire truck be use in philippine of emergency equipment in cebu philippi
3804,there s a fire truck in this parking lot
3805,evening sun article on n no
3806,choose to be happy fire truck the rest review of kick push by
3807,former township fire truck be use in philippines langley times filipino
3808,jacksonville fire amp rescue engine awesome truck official jade fl via
3809,nj turnpike nj turnpike reopen hour after truck fire in 
3810,luke box something about first responder military PRON be PRON true heros besides PRON music
3811,PRON be grateful for PRON first responder and other who act so swiftly to save countless life today
3812,pray for god healing and safety of first responder
3813,join charity k run event start sun sept castle donington community first responder s
3814,love the way this book be write to include so many vantage point of first responder kindle
3815,first responder would never be send to the wrong address again w smart tek s gps base panic button m per safety
3816,PRON can help say denver firefighter work to curb first responder suicide
3817,what s cool be that teen be become what i like to call digital first responder for PRON friend who need a little help or support
3818,car mike cinema on antioch shoot PRON be grateful for staff and first responder safety be high priority
