5579,former freedom surf spa raze to make way for new home
5580,the late more home raze by northern california wildfire abc news
5581,tension in a bia as in ec office raze governor ik pea zu pdp a pga react
5582,the late more home raze by northern california wildfire the late on wildfire burn in california and
5583,the late more home raze by northern california wildfire
5586,the late more home raze by northern california wildfire lynchburg news and advance
5587,news the late more home raze by northern california wildfire new york times taf s fb
5593,how significant do PRON think the iconic pic of church maybe ruin and less substantial effort raze
5597,at least PRON be sincere
5601,more home raze by northern calif wildfire san diego
5602,george nj enga the hero save PRON burn friend from a razing wildfire
5603,today will be another dual com with if PRON enjoy yesterday check out today at pm easter
5604,the late more home raze by northern california wildfire abc news gn
5608,the late more home raze by northern california wildfire zipped news
5613,vassal boro house to be raze to make way for public gazebo report
5614,this just mar rie turkish couple give syrian refugee an incredible gift feed PRON instead of family amp friend
5615,police monitor jihad is in poland via
5616,turkish newlywed donate we d money what a beautiful gesture still have faith in humanity
5617,this just mar rie turkish couple give syrian refugee an incredible gift washington post
5618,repulsive refugees victim is er dutton evangelical liar abbott co ln p on a dupe the press overdrive chopper gate bronwyn bishop a us pol
5619,re tweet cameroon repatriate about nigerian refugee due to boko haram
5620,newlywed feed syrian refugee at PRON wedding cbc news late canada world entertainment and business news
5621,wow o nigerian refugee repatriate from cameroon
5622,hmm nigerian refugee repatriate from cameroon 
5623,wha o nigerian refugee repatriate from cameroon
5624,imagine an entire aisle dedicate to make people look like serbian refugee director of whole food clothing section
5625,couple spend wedding day feed syrian refugee see more
5626,re aad pl s s nigerian refugee repatriate from cameroon
5627,top story couple spend wedding day feed syrian refugee see more
5628,refugee connection in diego go campaign will be go live tomorrow support PRON and help launch the only online community for refugee
5629,PRON all read nigerian refugee repatriate from cameroon
5630,short of throw PRON overboard PRON i do not think any other leader could do much bad by refugee than bad pm ever
5631,cameroon repatriate nigerian refugee
5632,captain abbott must go down with ln p boat refugee christian value
5633,a turkish couple spend PRON wedding day feed syrian refugee a turkish couple who get mar rie
5634,how one couple be use drone to save refugee at the world deadly border
5637,turkish couple decide to feed syrian refugee as part of PRON wedding celebration 
5638,lt right now even after two year there be still refugee camp just south of redcliffe village and aidan gt
5639,newlywed feed thousand of syrian refugee instead of host a banquet wedding dinner age news
5640,in photo the young refugee force to flee burundi s violence vice news see more
5641,thank PRON and for help so many people in need all over the world 
5643,newlywed feed thousand of syrian refugee instead of host a banquet wedding dinner via
5644,pac ic media centre article australia rsf protest over new security gag over report on
5645,recap nigerian refugee repatriate from cameroon
5646,the most generous bride on earth couple feed syrian refugee on PRON wedding day via love PRON
5648,the returned refugee what be PRON flee from amp how will the vietnamese govt treat PRON now PRON be return dutton presser
5649,chp s re rt refugee for PRON follower in paris do visit a dream of humanity exhibition by reza photography
5650,policyholder object to cli co rescue plan 
5651,do not panik kel by tomlinson to the rescue
5652,coastal german shepherd rescue oc share a link animal rescue 
5653,ud rescue structural collapse scott road ypres road york truck
5654,rescue of the day PRON world cat day saturday aug th black black white cat just new beginnings animal rescue
5655,PRON be on blood pressure med and PRON still probably through the roof long before the p pact story break i be involve in animal rescue
5657,coastal german shepherd rescue oc share a link ecstatic rescue racc o animal rescue
5658,suggs amp vivian to the rescue psych re watch
5659,any length to rescue a cat in need
5660,last chance animal rescue have new post animal rescue 
5662,sammy and todd always to the rescue may not be in uniform but still to the rescue l mao forever kfc fam
5663,lunch for the crew be make night night PRON been a long day peace love rescue
5664,tell the united nations plantation be not forest via
5665,mary come to troy rescue 
5667,flood zone general ra heel sharif visit chitral PRON also laud the effort of f wo army troop and army aviation in rescue opera
5668,last chance animal rescue have new post animal rescue
5669,how many dog do PRON have and be PRON all rescue dog
5670,official rescue migrant off libya body find fox news news
5672,this be sabrina PRON dad rescue PRON from some dude who keep PRON in a cage PRON have have PRON since i be
5673,briton rescue amid himalaya flood
5674,kidnapped lady rescue by police in en u gu nigerian tribune
5675,rescue med migrant arrive in sicily
5676,i hand PRON a glass of water and s it down i be rescue by a tenno PRON have live in PRON ship around the dojo for about a year
5677,trust PRON to get rescue by the dopey one val be hilarious shame PRON s probably go to die emmerdale
5678,summer summer vibe california puppy pit mix rescue brixton banksy happy my babies
5679,man who bury dog alive think no one would find PRON but PRON be rescue just in time
5680,month old baby girl be rescue by coastguard after PRON float half a mile out to sea social new
5681,but now sky rim await to be rescued again
5683,the finnish hip hop pioneer paleface will be rescue from a drift raft and bring into the container later enke l bil jett meno lip pu
5684,bovines rescue smugglers nabbed
5685,fund need for rescue then abandon cocker spaniel
5686,i like a video roman atwood v log rescue sick kitten
5687,news briton rescue amid himalaya flood
5688,a brave little dog get rescue from the river PRON recovery will in spi via
5689,homeless man travel across usa with stray dog PRON rescue get a help hand from stranger via
5690,break news tonight kid be rescue from play room after a week with no food or water do to parent sex life hah a
5691,PRON can only be rescue from where PRON actually be and not from where PRON pretend PRON be giorgio hiatt
5692,PRON rescue PRON dog at least year ago PRON s old but still sweet as ever
5693,rescue med migrant arrive in sicily hundred of migrant rescue
5694,why be not PRON take back to africa once rescue c news
5695,migrant rescue after boat capsize off libya
5696,young child among those rescue from capsized boat off libya via
5697,hero a springer spaniel amp PRON dog dad rescue a strand baby dolphin 
5698,trust PRON to get rescue by the dopey one emmerdale summer fate
5699,three beach whale rescue in kerry 
5700,rescue tb go on to ribbon at hit via
5701,turn back to PRON i have rescue PRON and sweep away PRON s in as though PRON be cloud isaiah contemporary english version
5702,pet r like part of the family i love animal the last pet i have i rescue break PRON heart when animal be mistreat
5703,i like a video homeless dog live in a cardboard box get rescue amp have a heartwarming
5704,angry mistrustful rescue elephant find peace and friendship in PRON new home photo via
5705,photo hundred of rescue migrant await disembark ment from an irish naval vessel at palermo italy
5707,video be pick up body from water rescuer be search for hundred of migrant in africa news
5708,video be pick up body from water rescuer be search for hundred of migrant in the medi terran
5711,video be pick up body from water rescuer be search for hundred of migrant in the mediterranean
5712,world fear over miss migrant in med rescuer search for survivor after a boat carry as many a news
5713,rescuer be search for hundred of migrant in the mediterranean after a boat carr 
5714,i have an unexplainable desire to watch the rescuer childhood define
5715,roddy piper autos fear over miss migrant in med rescuer search for survivor after a boat carry as ma
5716,channel have be do the same for the rspca with dog rescuers the infomercial have creep in the back door
5717,video be pick up body from water rescuer be search for hundred of migrant in the mediterranean after a boat carry i
5718,womans gps app guide rescuer to injure biker in marin county
5723,last second ebay bid rt shaolin rescuers dvd shen chan nan chiang five venom kung fu please favor i
5725,world news video be pick up body from water bbc news home rescuer be search for hundred of
5727,video be pick up body from water rescuer be search for hundred
5728,ah maze story of the power animal rescuer have a starving homeless dog with no future be rescue by a person
5729,rescuer be search for hundred of migrant in the mediterranean after a boat carry as many as people capsize off the coast of
5730,news many death in shipwreck rescuer be try to save hundred of migrant after the via
5733,when rescuer find PRON PRON be barely alive but PRON have no idea PRON be allergic to this
5734,fear over miss migrant in med rescuer search for survivor after a boat carry as many as migrant
5736,womans gps app guide rescuer to injure biker in marin county sf gate
5738,rescuer find survivor of nepal earthquake bury 
5739,rescuer recover body of year old calgary man from lake near vulcan
5741,video be pick up body from water rescuer be search for hundred of migrant in the bbc news
5742,to all the meat love feminist of the world riot grill have arrive pop quiz which do PRON prefer fem art
5743,stuart broad take eight before joe root run riot against aussie
5744,i predict a riot
5745,discover by listen buy riot on blow mandy up
5746,to all the meat love feminist of the world riot grill have arrive art
5747,rascal flatts riot tour atlantic city beach concert august ticket
5748,to all the meat love feminist of the world riot grill has arrive
5749,seriously do PRON have to do a tactical riot against the headquarters of disney and marvel
5750,keep an eye out well be look for lot of new team member in come days week
5751,to all the meat love feminist of the world riot grill have arrive pop quiz which do PRON prefer feminist
5752,self ie at booth or riot kappa
5753,ill start a big as s riot send PRON to jail today mfs shi dd
5754,riot kit bah part of the new concept gear come for autumn winter menswear fashion urban fashion
5756,i like a video thorin thought riot and sandbox mode lol
5757,stuart broad take eight before joe root run riot against aussie stuart broad take career b figure of 
5758,re tweet e sarah silverman of PRON walk start w tracey ullman PRON do not know perfect
5759,to all the meat love feminist of the world riot grill have arrive
5760,after all that time riot should really make an official satan te emo skin
5761,i like a video sick riot shield slide spot
5762,torre cilla PRON always info the secret on lol game check the secret to get riot point on PRON bio
5763,transwoman and drag queen of color lead the riot a well know butch lesbian be usually credit for incite PRON
5764,PRON can now pre order the film on itunes amp watch yay
5765,without an ally near PRON can not use this skill how do PRON get hire really cause PRON make every riot staff member look incompetent
5766,pop quiz which do PRON prefer feminist revolution or fry ravioli with porc in i and ricotta 
5767,to all the meat love feminist of the world riot grill have arrive olivia mile
5768,except PRON do not know who start the riot or if PRON even make sense to credit any particular individual
5769,juan carlos salvador the secret tip to get riot point lol be out now check the secret on on PRON bio
5770,southeast dirt riot series crown champion southeast dirt riot series crown champions blackfoot PRON would the so
5771,sweet peas be run riot at the allotment and brighten up a rainy day
5773,riot police intervene after southampton and vitesse arnhem supporter clash fan clash in buildup to second
5775,cracker white riot now play e
5776,but the government will not care police will stop riot eventually of protestor eventually some skyscraper become plant covered
5777,new do co tonight at pm setanta sports ireland freeview the large police presence at a soccer game in ireland stop prevent the rioting
5778,eric clapton shoot the sheriff in and guess how many people be riot right none
5779,if PRON kill off val PRON be rioting emmerdale
5780,money can not buy happiness be just a lie PRON tell poor people to keep PRON from rioting
5781,bloody hell PRON already be upgrade to riot hyperbole saints fc
5782,twitter be do a count down to the rioting and financial collapse of brazil rio
5783,if that would of be a black dude antioch would be riot
5784,recently meet with the to discuss race relation in america amp the benefit of riot love is love
5785,people like PRON should be charge after the inevitable rioting for contribute to PRON with PRON lie
5786,cindy noonan in baltimore rioting ya historical underground rail rao d
5787,lee d fan riot in em bra at a low tier league cup final dee dum
5788,still riot in a couple of hour leave until i have to be up for class
5789,there be plenty of black people riot when tosu win the championship as well
5790,the ferguson riot work this of this the next time PRON say rioting do not change anything there fix PRON for PRON
5791,bbc new the as s of british insurer say rioting will cost insurer amp million but police number be reduce by blind fat con tr
5792,bh rama bull watch run the jewel use fact to defend rioting in ferguson the socially minded duo take on the
5793,i think twitter be invent to keep PRON insomniacs from riot in the wee small hour
5794,people be not rioting because justice have be serve and that murderer be behind bar simple no justice no peace justice peace
5795,still riot in to gmail
5796,rioting
5797,if i do not get PRON money by tomorrow rioting
5798,rt why sweden be not venezuela there have be a few day of rioting in venezuela with the riot direct at gr
5799,or the rioting in happy valley after penn state lose
5800,a group of mascara smear girl rioting will be horrific i think
5801,the last time a high profile name be due to be sign for n ffc the city be riot wesley ver hoe k now a household name dont panic
5802,what alternative legal alternative protest rioting may not be the most peaceful thing but PRON a demonstration of how
5803,i be so sick of criminal parent and friend riot when PRON be kill by police PRON do not give a damn when officer be
5804,but the rioting begin prior to the decision for the indictment so PRON be not really make sense at this point
5805,the as he test match be currently more interesting than stupid congress rioting
5806,people riot everywhere and i think PRON would be one of the mus amis an lt
5807,football hooligan jail for rioting before game in scotland be already ban from match in england uk news
5809,be bbc new the as s british insurers say rioting will cost insurers million but police number be reduce by blind fat controller
5810,i have live amp PRON family have live in country where looter be shoot on sight where rioting be not tolerate why here
5811,refuse to let PRON life be reduce to rubble when the shit keep pile up get a shovel
5812,china s stock market crash be there gem in the rubble china stock market crash this su via
5813,if PRON go on with this nuclear arm race all PRON be go to do be make the rubble bounce winston churchill
5814,china s stock market crash this summer have spark interest from bargain hunt
5816,PRON parent be so impulsive sometimes i remember come home to PRON room fill with dust amp rubble just because PRON want PRON redesign
5817,turn rubble from disaster into lego brick PRON can build house with this one belong in crazy ideas college
5818,wise news china s stock market crash be there gem in the rubble
5819,forbes china s stock market crash be there gem in the rubble china stock market crash this summer ha
5820,forbes europe china stock market crash be there gem in the rubble
5821,china s stock market crash this summer have spark interest from bargain hunter and bull bet on a rebound d
5822,again i do not say PRON be i be refer to the main building be hit by rubble
5823,china s stock market crash be there gem in the rubble
5825,jun yemenis search for survivor under the rubble of house in the old city of sana follow an
5826,china s stock market crash be there gem in the rubble forbes asia
5827,steve buscemi be a firefight r b fame amp work d hr shifts digg in thru wtc rubble look g survivor
5828,china s stock market crash be there gem in the rubble t cot p news
5829,china s stock market crash be there gem in the rubble china stock market crash this summer h by forbes
5830,i find a diamond in the rubble
5831,tnn china s stock market crash be there gem in the rubble
5832,china s stock market crash be there gem in the rubble roi mentor yy c walks
5835,new post china stock market crash be there gem in the rubble
5836,china s stock market crash be there gem in the rubble china stock market crash this summer have spark 
5837,photo post apocalyptic flimflam prod around the rubble
5839,damn s uh do not let that ruin PRON year b ruh this PRON year better start car poole like PRON do back in the day
5840,if i can not ruin PRON mood then i may have lose PRON direction
5841,i ruin everything
5842,quote never let PRON problem ruin PRON faith
5843,PRON be so anxious though because so many ppl will PRON watch PRON meet PRON and that make PRON uncomfortable but i can not let that ruin the moment
5844,smoker that ruin that new car smell
5845,just wait until PRON friend at mta ruin PRON sorry but its true
5846,PRON be really sad about red closing yuppie n tourist ruin everything
5847,always get to ruin PRON mood
5848,i understand PRON want to hang out with PRON guy friend ill give PRON PRON space but do not ruin PRON trust with PRON
5849,like why on earth would PRON want anybody to be unhappy do not purposely ruin somebody else happiness
5850,fresh out da shower looks s still love this new hair do PRON ruin PRON brand yes
5851,see try na ruin PRON life
5852,well do PRON everyone applaud PRON and how terrific i be and how i never ruin anything
5853,four thing that may ruin PRON personal injury accident claim
5854,how to ruin the holiday in word k PRON a zm ne
5855,every time i have a really good day someone just have to ruin PRON
5856,PRON wanna ruin a relationship just ask what be PRON intention and PRON will do PRON
5857,and then i go a ruin PRON all with something awful minion
5858,PRON be really awful and i can not even work with a make up artist now because PRON will ruin thing
5859,damn wale know how to ruin a song
5860,cause PRON play PRON like a symphony play PRON till PRON finger bleed PRON be PRON great masterpiece PRON ruin PRON
5861,why do PRON family have to ruin something that be actually go good for PRON
5862,i hate that PRON be so awkward and i ruin thing
5863,long road to ruin foo fighter
5864,why do u ruin everything u ruin the sour cream and u put a brick of cheese in the freezer dummy
5865,do not let a few asshole ruin PRON night
5866,lol the real issue be the the way the nfl be try to ruin this guy legacy
5867,rt to ruin s day
5868,greedy bastard way to ruin creativity censorship on 
5869,PRON should not be with PRON be go to ruin PRON game and vanessa be a great player
5870,yes yes i will i do not wanna ruin PRON life lol
5871,i wanna see PRON reboot the fresh prince of be lair bring back the original cast and everything amp do nothing that will ruin the show
5872,PRON can only make PRON happy fuck those try na ruin PRON keep smile
5873,there be a few people PRON would let ruin PRON life PRON soul PRON cervix PRON everything odell be definitely top of that list
5874,ill ruin PRON life if i have to
5875,babe PRON be go to ruin PRON if PRON let PRON stay
5876,everything must be ok because PRON s listen to sandstorm now
5877,watch this airport get swallow up by a sandstorm in under a minute
5879,PRON would not turn into a sandstorm if riot give a good answer instead PRON give dumb excuse at least new client be there
5881,i like a video da rude sandstorm
5887,a sandstorm in jordan have coat the middle east large refugee camp in a layer of grit 
5888,sandstorm woo hoo
5893,who need friend when there s booze and da rude sandstorm d
5894,social wot globi inclusion rt nrc middle east sandstorm engulfs caravans and tent in the za atari refugee camp
5900,two hour of sandstorm remix e all merge together no between song silence
5903,put sandstorm down
5907,come out to sandstorm tryout aug th at low woodland ms tryout pm hs tryout pm
5909,be PRON da rude sandstorm
5910,i can not listen to da rude sandstorm without expect air horn now
5911,now play da rude sandstorm radio edit 
5913,i slam PRON phone to the ground and then scream aha hah ga
5914,i just scream to the world how much i love PRON little pony
5915,update the police seem like nice enough people i feel bad when i transform and PRON scream do not worry PRON be only unconscious
5916,someone go to get scream at for get the lyric wrong l mao
5917,i just scream sid js j dj ek djs k dj d i can not stand PRON 
5918,of loki s dagger PRON pull PRON out and jam PRON into minas thigh when mina scream and grab at PRON leg s if
5919,omf g didnt expect drag PRON down to be the first song pandora play omf g i scream so loud my coworker be scare
5920,PRON scream when PRON get the microchip needle t bh i would have cry too the needle be massive ya haram
5921,i hear the steven universe theme song from upstairs and scream PRON name at the part of the song and scare PRON cousin
5922,i scream after hit tweet
5923,the girl next to PRON scream what the fuck be a ch once PRON be cry i bg
5924,i think the loud goal i ever scream be higua in offside goal against germany
5925,i run with ear bud in which i now realize mean i probably do not politely say hi to jared but more or less scream at PRON
5926,i just get scream at for ask PRON dad to move half a step so i could get through
5927,i dead as s scream when PRON sign PRON i could not fucking believe PRON
5928,do not stop believe just come on the radio at this restaurant and a lil white bit scream PRON mommy s song
5929,brooke just face time PRON at the concert and just scream for minute straight
5930,want to make tweet about how much i dislike today fem n is m movement but do not want to be scream at
5931,people have scream right in PRON ear this week at camp twenty six and PRON still have day leave cedar glade
5932,some kid go to leadership camp come into PRON work today ask for the bathroom and PRON inner as b kid scream a lot i miss camp
5933,vacation update PRON great aunt just kill a spider with PRON bare hand after i scream in fear fierce
5934,not because i want to cheat or anything just feel good to vent to PRON twitter without a txt be scream at lol
5935,PRON be sorry PRON be so wild in d show like in PRON wwa show niall start singe steal PRON girl i literally scream shut the fuck up
5936,i just scream in language this be so good
5937,i scream at the end o a msg a jag aha hah PRON be laigh ign o tra metlife
5938,i have never scream so loud
5939,i scream what s a ch once
5940,i scream at the top of PRON lung when PRON say PRON guy would come back to s a so keep PRON promise add texas to next d tour
5941,why PRON scream
5942,i literally walk out of the concert and scream PRON soul have be bless
5943,i just scream what the fuck be a hon d
5944,i just scream 
5945,kinda scream gt lt
5946,i do not even remember sls p happen i just remember be like wtf and then the light turn off and everyone scream for the encore
5947,love wake up to PRON dad scream at PRON
5948,if PRON be quiet enough PRON can literally hear the phan dom scream at the tyler tweet
5949,PRON be scream and fan girl ing oh my god
5950,during drag PRON down last night i be scream shell of a mannequin instead of shell of a man and i think everyone hate PRON there
5951,internally and externally scream
5952,cue the j ariana stans scream
5953,scream
5954,now PRON be internally scream
5955,the first time i go swim in PRON i be basically scream why do PRON smell taste so bad
5957,lh h silent screaming be master
5958,PRON s hot amp PRON can sing PRON be scream
5959,PRON fine baby i be scream at the tv x
5960,harshness follow PRON a better day by sarah c race thought with scream siren space back and forth for
5961,PRON fa vs PRON be scream so fucking loud
5962,PRON be scream
5964,cami la do a follow spree tonight PRON be scream of happiness
5965,sorry for scream at PRON and from the car i just kinda i know those people let yell
5966,PRON dad a scream coach always give PRON vocal chord quite the workout on the field funny dad coach
5967,how do people not know who kendall jenner be PRON have time the insta gram follower of gd scream l mao
5968,and if PRON have a scream baby PRON would have love that so much more
5969,PRON be scream omg idol day w dy m
5970,can PRON hear PRON scream
5971,fucking scream
5972,all the love be scream at this one
5973,hey there lonely girl did PRON have to tell PRON friends about the way i get PRON scream PRON name
5974,no chill uk e hamming sim scream
5975,if PRON follow PRON i will go into town and advertise PRON channel by scream and walk around with a sign pl s
5977,PRON be scream PRON s PRON favourite
5979,scream in different language
5980,i be scream hell yes ahh omg
