1780,i feel that crash and burn by thomas rhett for sure
1781,motogp indianapolis espa r garo layout worry PRON a little
1782,just buy another medium crash hey what about an endorsement start to get expensive
1783,html beginners crash course course
1784,a slam door and a lesson learn i let another lover crash and burn
1785,who have a car crash sterling who be drive in the carmel or joey ster le knight
1786,alright now PRON be go to crash PRON be so exhausted
1787,party for best i val crash victim michael moll oy on what would have be PRON st
1788,clear crash in hamilton on i south at mm
1789,deliver value a cash source crash course course
1790,the next financial crash the writing be on the wall do not say PRON be not warn
1791,be boy 
1792,make man pi kin crash
1793,incident crash in pascoe vale south outbound on tull a marine f wy citylink near moreland rd vehicle off in emergency lane no delay
1794,i let another love crash and burn
1795,if PRON s it and rant on snap chat to PRON apparent fan when PRON have about follower i hope PRON in a train crash x oxo
1796,crash and burn 
1797,c panel crash course course
1798,get kick out by that crash be one of the bad experience PRON have have play video game
1799,ill crash PRON
1800,please keep josh the s aly ers blair hall family amp jenn as friend in PRON prayer PRON be take far too soon rip
1801,one night and be go to come and crash the party were nt invite but be feel in so
1802,fatal crash report on johns island
1803,photoshop tool crash course complete photoshop tool guide course
1804,photoshop cs crash course course
1805,kinetic typography crash course after effect video course
1806,police respond to crash find suspect heroin
1807,i see dat PRON liable to fuck up and crash
1808,akil ah world news cop pull man from car to avoid this 
1809,man kill in crash in barrington hill a hoffman estate man be kill in a single car crash wednesday aft e
1810,crash helmet silvery floor karn al fat shoot sampling pb can pc x
1811,crash test trailer paul scheer amp rob hue bel s comedy special record on a 
1812,i try download PRON and PRON crash after the tutorial
1813,maj mu zz amil pilot of fr of mi crash near mansehra today
1814,bin laden family plane crash after avoid micro light and landi perito en graf osco pia
1815,PRON son do not sleep all night so finally at am i lay PRON with PRON on PRON bed and PRON crash out
1816,neil eastwood i be a knob head bin laden family plane crash after avoid micro light and landing t
1817,bin laden family plane crash after avoid micro light and land too far down runway three member of t
1818,ux fail of em v people want to insert and remove quickly like a gas pump stripe reader person tell PRON PRON crash the pos
1819,major ham a yun shaheed pilot of mi he li that crash in mansehra
1820,uk bin laden family plane crash after avoid micro light and land too far down runway three member 
1821,PRON have crash so many time the past couple hour
1822,gt bin laden family plane crash after avoid micro light and land too far down runway rochdale heywood
1823,PRON ipod crash we love you louis mtv hottest one direction
1824,hear this few day ago while drive and near crash the car from laugh to much
1825,h avn t PRON crash 
1826,could anyone tell PRON of this here have crash or just take a very long time window please
1827,intact mh part lifts odds plane glided not crashed into sea via for answer
1828,pak army helicopter crash in mansehra
1829,the bug that almost crash the euro 
1830,pakistan say army helicopter have crash in country s restive northwest kill at least
1831,news bin laden family plane crash after avoid micro light and land too far down runway
1832,this guy buy PRON car on tuesday police knock PRON door y day co PRON crash n run amp day PRON text PRON ask not to send the log book
1833,maj mu zz amil pilot of fr of mi crash near mansehra today may almighty give strength to family to bear the loss
1834,thief break front window of hicks ville store steal cell phone flee crash into
1835,army source say person on board include a team of doctor die in helicopter crash near mansehra weather seem to be cause of crash
1836,skype just crash u host
1837,i already have PRON phone update to and somehow PRON phone crash and i have to restore PRON and PRON be not let PRON restore PRON
1838,PRON be only of a second faster than PRON and i overtake PRON twice then crash tru luv lt lt
1839,i just nearly crash PRON car type paul rudd attack by fly ant into note on PRON phone
1840,honestly nightmarish god drive to new place be always stressful as shit amp i hate PRON so much ugh almost crash a few time
1841,i crash PRON car into a park car the other day modest mouse remix true story
1842,fd mh tw f net pakistan say army helicopter have crash in country s restive northwest fox news
1843,t tw todays news bin laden family plane crash after avoid micro light and land too far down runway
1844,hear skh on the radio for the first time almost crash the car
1845,mh intact part lift odd plane glide not crash into sea
1846,more like PRON love PRON husband but PRON be post another man for PRON man crush monday lol
1847,wo mem crush wednesday 
1848,PRON bf gf crush
1849,this guy i dk just make PRON PRON woman crush first one ever
1850,w ce i can not even lie even tho i can not stand PRON PRON still will always be PRON crush 
1851,woman crush 
1852,PRON woman crush wed ne day go to the beautiful love you u a in t she per ty
1853,be best friend with PRON high school crush
1854,in a bute girl crush
1855,same l same l have a crush
1856,PRON be PRON own woman crush
1857,love love love do PRON remember PRON first crush 
1858,have a minute alone with PRON crush it be an overrated experiences mh
1859,que crush mtv hottest just in bieber
1860,master f sloth have a crush
1861,PRON lil brother have a crush on mariah
1862,ron amp fez dave high school crush via
1863,when PRON be girlfriend be completely gorgeous woman crush amp stuff
1864,PRON be so high moe PRON be bout a crush this friday
1865,i have the big crush on PRON amp i do not know if PRON will ever know PRON
1866,mr robinson be give PRON the steve harvey show vibe music teacher look out for student have crush on girl PRON go to high school with
1867,seriously have the big girl crush ever on blake lively
1868,when PRON see PRON crush in the stand vine by 
1869,y h ngs j lg just tweet about PRON secret crush
1870,yeah i have a crush on PRON
1871,PRON try to look cute wen crush be pass by 
1872,crush content marketing mediocrity 
1873,only have a crush on one girl in high school and PRON do not even realize PRON lol
1874,seven fig z have a crush
1875,man crush every fucking day
1876,tiffany frizzell have a crush
1877,more than a crush w ce
1878,l mao well i only know one and PRON have only have a crush on this one soo
1879,now play e fitz and the tantrum out of PRON league on crush listen now play e
1880,man crush everyday
1881,do PRON love PRON do PRON love PRON not i be not a play a i just crush a lot
1882,kenny holland crush da vida
1883,crush
1884,this popeyes bout to get crush
1885,that be crush holy shit
1886,b havana s mom have crush everyone soul
1887,crush PRON
1888,wrap up us cable tv company share crush after disney disappoint
1889,i crush squirrel bone with a mortar and pestle for PRON school bio dept not really sure why worst summer job
1890,edwin wow crush
1891,mango juice with crush ice gt gt gt gt
1892,man crush to death by own car
1893,a diamond be just a piece of charcoal that handle stress exceptionally well PRON be hard press on every side but not crush cor
1894,wow PRON crush that ed we bluejay
1895,crush the gym then crush a butter fin g flurry clearly PRON priority be straight
1897,so the question be would PRON crush ortiz for bunting as PRON sport writing forefather crush williams
1898,ouch cle lli you could almost hear PRON hope and dream be crush
1899,jesus christ that ball be fucking crush bluejay
1900,i crush a km run with a pace of with nike sport watch gps nike plus
1901,papi absolutely crush that ball
1902,crush a mile run tonight awesome
1904,oil price fall but driver could reap benefit
1906,nick williams just hit another bomb just crush PRON
1907,holy mol y that be crush
1908,aye ko radio play brass work agency crush and shake radio net label electronic music listen cc music
1909,so many commenter say the do thr aki would get crush if PRON come to west eros nah bro PRON underestimate the do thr aki
1910,disillusioned lead character check happy go lucky free spirit girl check dream life crushed check great music check all crowe trope intact
1911,remember how nora jones crush PRON in two week notice
1912,how empire avenue crush PRON soul via
1913,m chap ou tier c roze hermitage so much purple violet slate crush gravel white pepper yum france wine dc
1914,the thirst have no curfew 
1915,ara news report jan fighter infiltrate ashraf i yah district of afr in with aim of carry out suicide attack y pg have impose a curfew
1916,thirst have no curfew
1917,and the fact that i have a curfew
1918,shut up freshman PRON past ur curfew u need some sleep u spend too much of ur time watch tv instead of go outside
1919,be there a night curfew on campus find out here 
1920,police teenager arrest for curfew violation in evanston be ride steal bicycle two teenager take into cus chicago news
1921,for some reason PRON be listen to curfew overtime and stick in a kodak over and over again
1922,i should have give PRON a curfew
1923,curfew really help if PRON think about PRON bc
1924,ex officio men boxer brief curfew large
1925,info s w nd cl d s ct b kn exp in st ap ch rwy curfew in oper until z taxiway s foxtrot amp foxtrot nav bl t mp
1926,thank PRON now i do not have a city wide curfew
1927,PRON just say do PRON have a curfew nope
1928,PRON curfew will start right after PRON private class end tutor must a woman preferably someone over
1929,there be no such curfew
1930,PRON be past curfew and PRON be at the grove
1931,because PRON o clock and PRON mom say everyone have to go home because of curfew
1932,PRON say a few month but i get a curfew for out time sm fh
1933,ball have no curfew
1934,i be see PRON turn a blind eye to a blok e drinking and smoking on during the curfew time cos it not worth the hassle
1935,next may ill be free from school from obligation like family good of all that damn curfew
1936,i know will be say PRON final goodbyes to grandpa as see on news rip PRON always open to idea but may ve curfew
1937,people really still be have curfew even when PRON be amp graduate high school
1938,PRON be tell PRON mom PRON up past curfew o th
1939,have to cancel PRON cat doctor appointment because PRON decide to go out and play and not come home by curfew
1940,info r curfew in oper until z taxiway s foxtrot amp foxtrot nav bl w nd exp in st ap ch rwy damp t mp q nh
1941,but no lie though PRON pay to be the old sometimes like be the first to get a car and have no curfew freedom don that e
1942,info u cl d s ct b kn exp in st ap ch rwy curfew in oper until z taxiway s foxtrot amp foxtrot nav bl t mp w nd
1943,rite now man a t lk wi d out nuh curfew long side aka cum fi steal di show itz a rubbery di whole a dem fi k nw sound PRON music
1944,do not even come if PRON worry about curfew bc
1945,PRON get a whole curfew
1946,when PRON be hour late for curfew and have to pray PRON dog do not bark when unlock the door
1947,da judge give d is girl pm curfew
1948,in the beginning of summer PRON mom make PRON curfew now PRON back to and i can never go out and PRON wonder why PRON be always at home
1949,why charlie lim start at pm on this sunday i have curfew leh
1950,when u bomb and u try get home for curfew
1951,a ww baby walter re watching the pilot team scorpion cyclone
1952,the big ten have PRON annual football medium day but before PRON get into that here some cyclone hoop recruit nugget
1953,camera art photography new bolt cyclone dr pp dr dual outlet power pack for external camera flash
1954,PRON work for PRON purpose a large cyclone would be well i just do not have k this be
1955,a new tropical cyclone be form near guam once PRON be form PRON will be call m olave
1956,video new de j h austin thomas on be a cyclone ames tribune a me tribune video new de j h austin thomas on
1957,PRON need these plant in the pacific during the cyclone season PRON would help
1958,bbc force to retract false claim about cyclone pam via
1959,great condition easton cyclone softball bat fast pitch sk 
1960,severe weather bulletin no for typhoon hanna ph so u del or tropical cyclone warning issue at pm 
1961,the cyclone derive PRON power from a calm center so do a person norman vincent pea le
1962,ante hud hud cyclone chandra babu valle ne ante ga
1963,cyclone ko men devastate family in myanmar this week PRON need to help PRON today
1964,severe weather bulletin tropical cyclone warning typhoon hanna issue at pm thursday august
1965,back to the future in vanuatu how cyclone pam have encourage traditional way of living
1966,bank manager ask tom in an interview what be cyclone tom PRON be the loan give to purchase a bicycle
1967,excited for cyclone football
1969,talent misdirection cyclone pass ignite pass vanish drive phantom shot kuro ko bot
1970,now on com dev asia radio station in bangladesh broadcasting program to address the upcoming cyclone kom an
1971,like a cyclone imperialism spin across the globe militarism crush people and suck PRON blood like a
1972,mercury cyclone gt hood mould very nice core cobra jet cj gt 
1973,PRON be a cyclone passion over blow
1974,PRON majesty emperor salman khans unstoppable cyclone of entertainment humanity baj rang i bhai j a an create history everywhere c rose cr
1975,mercury cyclone gt quarter panel ds rear trim mould cobra jet cj 
1976,tropical cyclone info so u del or hpa maximum wind speed ms maximum wind gust speed ms
1977,if i may ask cyclone sama have PRON read jail fate by rind ou
1978,some drug and alcohol in jackson v roman house
1979,blend the old with the new in vanuatu to prepare for future emergency 
1980,w fp w fp deliver food to bangladesh flood victim after tropical cyclone ko men dhaka the united na
1981,rohingya house in kye e nock th ie hamlet from taung bazar region in but hid aung be severely damage in cyclone 
1982,cyclone by double g would be the cherry on top to this outfit oo td double ghat 
1983,PRON will probably allow PRON to ascend PRON but not get PRON to the damage max value
1984,drop PRON down on a nigga do damage 
1985,union say PRON be supportive of london yet be prepared to damage PRON economically m last time
1986,i like a video gta online collateral damage gta v online pc
1987,fyi accident property damage limestone ln col yellowstone way field stone dr
1988,fitness knee damage solution
1989,and here i be complain about phoenix mode in fire emblem turn out ray gig ant will have a difficulty option where PRON take damage
1990,wha t be this kid damage
1991,clear accident with property damage on ny eb at ny
1992,PRON crazy how a phone can do so much damage to a person
1993,PRON get pretty windy here too but no damage
1994,reuse advanced in life equipment in transit to drum champaign damage f db dp
1995,but if PRON be car ful about spot damage time of check in why not time of give away baggage PRON PRON loss all d wy
1996,storm damage report in west tennessee
1997,hey the royal love do damage with out
1998,PRON can keep this please ar achy s piece now deal weapon damage up from
1999,mage of fairy tail specialize in property damage natsu drag neel
2000,yeah but be fast and do extremely high damage be what PRON all about if PRON want fast then PRON be go to have to get u the
2001,the saw be fast af and do great damage i upgrade PRON a shit ton and use PRON exclusively for a whole play through
2002,let say a tree fall on PRON fence do PRON know how PRON homeowner insurance may help 
2003,tor for a tor situation only wind damage enhance wording be key imo
2004,what be happen PRON hear there be runway lighting damage by a contractor
2005,if the nda be write to damage PRON ability to offer PRON service in the future then PRON p roll y do not want the work anyway
2006,if trillion cross the line a rd time PRON do a field wide attack that do instant kill damage
2007,np metallica damage inc
2008,nine inmate charge with cause damage in calgary remand centre riot 
2009,pt cross sectarian protest powerful shia cleric say militia must withdraw ur fight in is is but PRON will not forget damage u ve do to ur ppl
2010,do homeowner insurance cover water damage here be some good thing to know 
2011,beach do damage to PRON shit
2012,cross PRON arm to cover PRON hand from do anymore damage h hello
2013,new post on PRON blog the sensual eye model cam damage toronto apr nsfw pussy as s boobs asian nude
2014,report hit amp run in roadway property damage at states ville rd
2015,devil may cry special edition vergil vs agnus window mission d md no damage by leeds tra if
2016,glaucoma occur when fluid build up pressure inside eye to a level that may damage optic nerve eye fact
2017,j sun news storm damage report in madison county thunderstorm damage report ar via
2018,s a puncture wind without foreign body of leave index finger without damage to nail initial encounter icd
2019,thank PRON for word of warning re queens wharf brisbane via
2020,this real shit will damage a bitch
2021,l mao fuck boy change PRON for damage control
2022,standard damage control
2023,PRON say PRON have superficial wound and PRON be the pepper spray that do the most damage
2024,dad i will not chase PRON constantly amp all the time but frequently with a great deal of danger and distraction lt
2025,i believe there be a shirt company now for every animal that have ever be in danger i better start see some change in wildlife
2026,danger of union bear
2027,the sign up be open for the fall for danger release day blast and review tour sign up here
2028,check out this rock in preview of danger zone come soon artists unite
2029,red flag warning for fire danger amp dry thunderstorm in bay area weather caw x by
2031,what be this like i could be in danger or something
2032,when the last tree be cut down the last fish eat and the last stream poison PRON will realize that PRON
2033,PRON take away preservation park r an imposition amp a danger to african people i never imagine
2034,indian govt amp medium should take serious concern about PRON safety PRON be in danger now
2035,training grain of wheat to bare gold in the august heat of PRON anger PRON be the no trespass lest PRON seek danger
2036,fett i loot ch be slang lucci oppression great danger come soon the album
2037,PRON appear PRON govt have lose an ethical and or moral relevance this mean the whole usa population be in danger from PRON
2038,do not like those head first slide especially into home danger
2039,permit for bear hunting in danger of outnumber actual bear the license for florida s fir st petersburg
2040,and not too much danger please
2042,be look to repair PRON recent bad rap with some nonprofit partnership
2043,i wish i could get victoria secret on front PRON be good for PRON
2045,why would arsenal fan want that west ham will be in a relegation battle this season no danger for afc on sun
2048,the danger and excitement of underwater cave diving 
2049,the girl that i wanna save be like a danger to PRON health try be with somebody that wanna be somebody else
2050,gun be for protection that shit really should not be use unless PRON life in danger
2051,so thirsty PRON all in danger of dehydration
2052,thunderstorm with little rain expect in central california high fire danger weather caw x
2053,i wanna get a danger day tattoo so bad how cool would that spider look like on someone wrist or sm th
2054,in PRON experience if PRON be always angry and critical as a pundit PRON be in grave danger of go off the rail
2055,i be not in danger sky ler i be the danger
2056,too dangerous for PRON but PRON ok for the rest of PRON to be in danger
2057,investigate why robert mueller do not respond to PRON complaint since nov amp just leave meson out PRON in danger
2058,honestly tho modibo mai ga be steal a living fuck all about PRON PRON be past PRON good but still more of a danger than that fuck tard coy i
2059,fear have a way of make PRON see danger where there be none contemplate the logic behind the situation and find the courage to engage PRON
2060,joel and book of act 
2061,dead as afghanistan aircraft crash an afghan military helicopter have crash in a remote region of the s
2062,why not even more awesome norse landscape with load of atmosphere and life than boring dead s not green wasteland
2063,i miss PRON longer hair but PRON be so dead anyways PRON be not even hair
2064,sake of arg suppose pre born have attain in div idl rights generally court of law forbid kill unless dead person do something
2065,remember that time goku give life to a dead bir b what the hell goku
2066,na a i bee dead like a legit zombie i feel every sore part in PRON body 
2067,PRON just happen to get on the same road right behind the bus PRON be dead serious
2068,lmfao fucking luis hh a hah a PRON be dead
2069,i just watch emmerdale nd i do not know who most of PRON be but a slightly attractive man name ross just get beat up nd now PRON s dead
2070,i need PRON to confirm that ross be dead cause i do not trust anyone else y h
2071,i was disappointed by telltales the walk dead good character amp story but no real gameplay and too many performance issue
2072,before its news hundred fear dead after libyan migrant boat capsize during rescue 
2073,if PRON a war PRON come to see PRON will never see a wave white flag in front mei can not end up dead i will not be mislead
2074,oh fuck sake PRON be dead
2075,be ross really dead ask charley
2076,don avoid wear dead black flame red and stark white so much and esp at debate go with PRON blue gold brown even to shoe and
2077,perspective on the grateful dead critical writing contribution to the study 
2078,hello PRON be look for mod cold ice i see PRON on PRON site but link to download dead maybe PRON have PRON and share with PRON thank
2079,lm a ov v hard the ny be the the new trend baba l mao welcome to nyo zi kwa a dead
2080,now PRON have say all this PRON s dead and no one else die
2081,be ross dead noo
2082,think of the time that PRON friend bail the nite b a dead show went alone amp have a great time all alone and free to dance front row
2083,typhoon so u del or take dead aim at taiwan
2084,ask charley emmerdale how emotional be PRON that ross be dead 
2085,man find dead in demi moore swim pool
2086,that s PRON val be dead PRON be sue
2087,PRON be dead
2088,wy rm wood road of the dead be fuck awesome and PRON have an awesome end too awesome one
2089,can not believe ross be dead emmerdale summer fate
2090,i will only call or text niggas PRON b ff amp PRON boyfriend i love PRON boy to death no other nigga can hold PRON attention like PRON
2091,i hate to talk ot p with PRON grandma i mean i love PRON as to death but PRON talk so damn much ssh he ess hh
2092,until PRON death ill forever rep the jet
2093,PRON vibrator shape v ape do bust
2094,death threat on a nigga life well then PRON gon see
2095,adult die of plague in colorado
2096,xbox pro console red ring of death full read by ebay 
2097,go back to gainesville will be the death of PRON
2098,a year later ferguson see change but ask if PRON real
2099,papi i champ oo what i enjoy most about the obama era be the civility prez say gop support iranian death to 
2100,i feel like death
2101,i like a video from dj hazard death sport
2102,i tell PRON cousin i do not wanna hang out and PRON text PRON say be come over honestly do PRON have a death wish
2103,rss judge orders texas to recognize spouse on same sex death certificate
2104,PRON loyalty mission involve PRON kick a shitty nobleman to death i love this elven weirdo
2105,there be a way which see meth right unto a man but the end there of be the way of death
2106,thanks i narrowly avert death that be fun PRON be right
2107,katherine death
2108,death to muslims
2109,go to starve to death
2110,ted cruz bashes obama comparison gop to iranians shout death to america
2112,new crime know PRON right punishable by death
2113,i have no issue upload death to smooch y or awakening clip to but for some reason bicentennial man be be a pain in the as s
2114,ted cruz bashes obama comparison gop to iranians shout death to america t cot
2115,cyprus news analysis mullah omar death may split taliban rank omar demise would certainly lead
2116,i feel like death holy mo lys
2117,video slay mexican journalist unknowingly predict PRON own death via
2118,there be this old lady rock in out to death metal in PRON sedan downtown smoke a cigarette i find PRON real mom
2119,afghan peace talk in doubt after mullah omar death financial times mullah
2120,PRON all pussy and shake to death of PRON
2121,the first trial in the death of cecil the lion be just postpone 
2122,year ago this week be the anniversary of marilyn monroe s death rip rip rip
2123,aris hint and snippet will be the death of PRON
2124,tomorrow will be the death of PRON
2125,new nyc legionnaires disease death toll rise follow
2126,vax shill death from measle complication in yrs everyone loose PRON shit dead from legionnaire in a month amp cricket
2127,bigamist and PRON first wife be charge in the death of PRON second pregnant wife PRON child PRON mother PRON nephew and PRON u
2128,do not get on i south huge wreck and airlift and maybe some death interstate be completely block
2129,case of voter fraud a year PRON need new law gun death a day who actually follow law amiri tev ra
2130,silence palermo shipwreck child death
2131,this why b sf jaw an die fi day een have ak and PRON bloody in s as in s as rifle not to blame for soldier death mod
