1,PRON deed be the reason of this earthquake may allah forgive PRON all
2,forest fire near la rong e s ask canada
3,all resident ask to shelter in place be be notify by officer no other evacuation or shelter in place order be expect
4,people receive wildfire evacuation order in california
5,just get send this photo from ruby alaska as smoke from wildfire pour into a school
6,rocky fire update california hwy close in both direction due to lake county fire ca fire wildfire
7,flood disaster heavy rain cause flash flooding of street in mani to u colorado springs area
8,PRON be on top of the hill and i can see a fire in the wood
9,there s an emergency evacuation happen now in the building across the street
10,PRON be afraid that the tornado be come to PRON area
11,three people die from the heat wave so far
12,hah a south tampa be get flood hah wait a second i live in south tampa what be i go to do what be i go to do fvc k flooding
13,rain flood florida tampa bay tampa or day PRON have lose count
14,flood in bago myanmar PRON arrive bago
15,damage to school bus on in multi car crash breaking
16,what s up man
17,i love fruit
18,summer be lovely
19,PRON car be so fast
20,what a goo a al
21,this be ridiculous
22,london be cool
23,love skiing
24,what a wonderful day
25,loo l
26,no way i can not eat that shit
27,be in nyc last week
28,love PRON girlfriend
29,cool
30,do PRON like pasta
31,the end
32,wholesale market ablaze
33,PRON always try to bring the heavy metal rt
34,african baz e break news nigeria flag set ablaze in aba
35,cry out for more set PRON ablaze
36,on plus side look at the sky last night PRON be ablaze
37,m ufc PRON have build so much hype around new acquisition but i doubt PRON will set the ep l ablaze this season
38,in ec office in a bia set ablaze 
39,barbados bridgetown jamaica two car set ablaze santa cruz head of the st elizabeth police superintend e
40,ablaze for PRON lord d
41,check these out nsfw
42,on the outside PRON be ablaze and alive but PRON be dead inside
43,have an awesome time visit the cfc head office the an cop site and ablaze thank to t it a vida for take care of PRON
44,soo pump for ablaze 
45,i want to set chicago ablaze with PRON preaching but not PRON hotel
46,i gain follower in the last week PRON know PRON stat and grow with
47,how the west be burn thousand of wildfire ablaze in california alone
48,build the perfect tracklist to life leave the street ablaze
50,first night with retainer in PRON quite weird well get use to PRON i have to wear PRON every single night for the next year at least
51,deputy man shoot before brighton home set ablaze
52,man wife get six year jail for set ablaze niece
53,santa cruz head of the st elizabeth police superintendent lan ford salmon have r
54,police arsonist deliberately set black church in north carolina ablaze
55,noche el best i a happy to see PRON teammate and train hard goodnight gunner
56,kurds trample on turk man flag later set PRON ablaze while other vandalize office of turk man front in diyala
57,truck ablaze r voor trek ker ave outside or t ambo in tl cargo section
58,set PRON heart ablaze and every city be a gift and every skyline be like a kiss upon the lip 
59,PRON sky be ablaze tonight in los angeles PRON be expect ig and fb to be fill with sunset shot if i know PRON peep
60,how the west be burn thousand of wildfire ablaze in california alone climate energy
61,revel in yours w mv video by mean of mac farewell ablaze w mv en route to dvd gt x rw m
62,progressive greetings in about a month student would have set PRON pen ablaze in the torch publication
63,rene ablaze amp j a cinta secret k fallen sky edit mar
64,steve these fire out here be something else california be a tinderbox and this clown be set PRON hood ablaze
65,now play e rene ablaze amp ian buff magnitude edm
66,huge fire at wholesale market ablaze
67,what time do PRON talk go until i do not know if i can make PRON due to work
68,i can not have kid c uz i get in a bicycle accident amp split PRON testicle PRON impossible for PRON to have kid michael PRON be the father
69,accident on i w nashville traffic traffic move m slow than usual
70,accident center lane block in santa clara on PRON nb before great america pkwy bay area traffic
71,have a personal injury accident this summer read PRON advice amp see how a solicitor can help otley hour
72,st louis car accident lawyer speed among top cause of teen accident car accident tee
73,report motor vehicle accident in curry on herman rd near stephenson involve an overturn vehicle please use
74,big rig radio live accident awareness
75,i mile marker south mooresville iredell vehicle accident ramp close at pm
76,rt sleep pill double PRON risk of a car accident
77,by accident PRON know what be gon happen
78,traffic accident n cabrillo hwy magellan av mir 
79,i mile marker to south mooresville iredell vehicle accident congestion at pm
80,the pastor be not in the scene of the accident who be the owner of the range rover
81,mom PRON do not get home as fast as PRON wish PRON why be that mom there be an accident and some truck spilt mayonnaise all over
82,i be in a horrible car accident this past sunday PRON be finally able to get around thank PRON god
83,can wait to see how pissed donnie be when i tell PRON i be in another accident
84,truck crash overturn on fort worth interstate click here if PRON have be in a crash gt
85,accident in ashville on PRON sb before sr traffic
86,carolina accident motorcyclist die in i crash with car that cross median a motorcycle rider travel
87,fyi cad fyi accident property damage nhs pine r rd horn dale dr
88,rt na ay f first accident in year turn on to chand a nee mag u from near mma taxi ram into PRON while i be halfway turn everyone conf
89,accident leave lane block in manchester on rt nb before eddy rd stop and go traffic back to nha delay of min traffic
90,accident property damage pine r rd horn dale dr
91,PRON be an accident
92,fyi cad fyi accident property damage wp d s th st
93,pm traffic accident no injury at will is foreman rd
94,a a shi qui actress anu ag gar wal on PRON near fatal accident
95,suffield alberta accident
96,mile backup on i south accident block the right lane at exit lang tree rd consider nc or nc to nc as alternate
97,have an accident change PRON life PRON will help PRON determine option that can financially support life care plan and ongoing treatment
98,break there be a deadly motorcycle car accident that happen to hagerstown today ill have more detail at wha g
99,be PRON marinade PRON or be PRON an accident
100,only have a car for not even a week and get in a fucking car accident mfs can not fucking drive
101,bahrain police have previously die in a road accident PRON be not kill by explosion
102,i still have not hear church leader of kenya come forward to comment on the accident issue and disciplinary measures arrest pastor n ganga
103,s cuf ps live and the game cy a
104,the man who can drive PRON further once the effort get painful be the man who will win roger bannister
105,ir ice moon aftershock dubstep trap music dnb edm dance ice
106,there be no victory at bargain basement price dwight david eisenhower
108,nobody remember who come in second charles schulz
109,PRON be speak from someone that be use a s cuf on xb most of PRON people will end up get on for ps also
110,the hard the conflict the more glorious the triumph thomas paine
111,growing ups poile go clay pigeon shoot and cry because of the aftershock
112,so i guess no one actually want any free aftershock tc
113,aftershock be the most terrifying good roller coaster PRON have ever be on disclaimer PRON have be on very few
114,aftershock
118,PRON be see PRON and issue at aftershock
121,wisdom wed bonus minute daily habit that could really improve PRON life how many do PRON already do life hack
122,aftershock protect PRON and profit in the next global financial meltdown by david wie de mer 
123,that moment when PRON get on a scary roller coaster and the guy behind PRON be just scream bloody murder silver wood aftershock
124,aftershock full streaming
125,gt gt aftershock protect PRON and profit in the next global financial book
126,sometimes PRON face difficulty not because PRON be do something wrong but because PRON be do something right joel os teen
127,the only thing that stand between PRON and PRON dream be the will to try and the belief that PRON be actually possible joel brown
128,praise god that PRON have ministry that tell PRON like PRON be now wd youth bible study
129,remember that PRON be go to die be the good way i know to avoid the trap of thinking PRON have something to lose steve job
130,try orange aftershock today PRON life will never be the same
131,i love PRON bb
133,aftershock back to school kick off be great i want to thank everyone for make PRON possible what a great night
134,people who say PRON can not be do should not interrupt those who be do PRON george bernard shaw
135,the first man get the oyster the second man get the shell andrew carnegie
136,anyone need a pu tonight i play hybrid slayer ps eu hm u
137,expert in france begin examine airplane debris find on reunion island french air accident expert o news
138,strict liability in the context of an airplane accident pilot error be a common component of most aviation cr
139,PRON lifetime odd of die from an airplane accident be in
140,expert in france begin examine airplane debris find on reunion island french air accident expert on wed n
141,a ww PRON be on an airplane accident and PRON be go to die what a cutie good job
142,family member of osama bin laden have die in an airplane accident how ironic m hmm gov shit i suspect
143,man go into airplane engine accident via
144,horrible accident man die in wing of airplane 
145,a cessna airplane accident in ocampo coahuila mexico on july kill four man include a state of coahuila government official
146,horrible accident man die in wing airplane watch the video
147,expert in france begin examine airplane debris find on reunion island french air accident expert on wednesday
148,expert in france begin examine airplane debris find on reunion island french air accident expert on wednesday begin examine t
149,kc a vote jk tid mba tawee l rip bin laden family member who kill in an airplane accident
150,i almost send PRON coworker nude on accident thank god for airplane mode
151,that or PRON might be kill in an airplane accident in the night a car wreck politic at PRON good
152,expert in france begin examine airplane debris find on reunion island french air accident expert on mlb
153,this be unbelievably insane man airport airplane aircraft aeroplane runway accident freaky
154,horrible accident man die in wing of airplane
156,usama bin ladin family dead in airplane crash naturally no accident
157,pilot die in plane crash at car festival via crash aircraft airplane pilot death accident car fest
158,strict liability in the context of an airplane accident 
159,d tn brazil expert in france begin examine airplane debris find on reunion island french air accident exp
161,horrible accident man die in wing of airplane wtf PRON can not believe PRON eye 
162,nicole fletcher one of a victim of crash airplane few time ago the accident leave a little bit trauma for PRON although PRON s
163,omg horrible accident man die in wing of airplane
164,omg i do not believe this rip bro airplane accident jet engine turbojet bo ing g
166,i have a airplane accident
167,PRON phone look like PRON be in a car ship airplane accident terrible
168,statistically PRON be at more of risk of get kill by a cop than i be of die in an airplane accident
169,airplane crash on house in colombia people die in accident
170,the shooting or the airplane accident
171,could a drone cause an airplane accident pilot worry about use of drone esp in close vicinity of airport 
172,early wake up call from PRON sister beg PRON to come over amp ride wher in the ambulance to the hospital rod kia i
173,twelve fear kill in pakistani air ambulance helicopter crash
174,two air ambulance on scene of serious crash between two car and lorry in ems ne
175,twelve fear kill in pakistani air ambulance helicopter crash reuters yu g van i
176,lead emergency service boss welcome new ambulance charity
177,anyone travel aberystwyth shrewsbury right now there s be an incident service at a halt just outside shrew ambulance on scene
179,ambulance sprinter automatic frontline vehicle choice of lez compliant ebay
180,new nano tech device will be able to target and destroy blood clot
181,PRON be hell a crazy fight an ambulance and a couple mosh pit
182,if i get run over by an ambulance be i lucky just saying random thought
183,news twelve fear kill in pakistani air ambulance helicopter crash til now dna
185,wait for an ambulance
186,PRON ok need a ambulance hah a hah that be good
188,pakistan air ambulance helicopter crash kill nine
189,nissan be PRON ok do PRON need medical assistance i can call an ambulance if PRON need PRON to
190,ems ny emts petition for per hour minimum wage ems paramedic ambulance
195,check out what s in PRON parking lot PRON say that until last year PRON be an ambulance in st johns
196,when PRON do not know which way an ambulance be come from ltl t
197,reuters twelve fear kill in pakistani air ambulance helicopter crash
199,why be there an ambulance right outside PRON work
200,this dog think PRON s an ambulance 
201,happen now hat zola h ems ambulance respond with dual siren and
204,twelve fear kill in pakistani air ambulance helicopter crash world new
206,what s the police or ambulance number in lesotho any body know
207,i be surprised PRON still can not standardised the clinical practice across the nhs ambulance trust
209,people who try to j walk while an ambulance be pass i hate PRON
210,the episode where trunk annihilate frei za be the clean shit ever PRON show that nigga no mercy
211,PRON shall be annihilate and all of PRON pete best des sica te and lay bare then PRON shall kneel before PRON
212,uribe just annihilate that baseball met
213,hey sundowns be annihilate in PRON previous meeting with celtic in dee PRON an improvement
214,miz zo u have annihilate florida the past season even end mus champ career just can not compete with bam a
215,annihilate abs
216,be annihilate for status education mba on behalf of a on easy street careen eo vm
217,to luka PRON should all die all of PRON everything annihilate alois tr an cy
218,have a good un fella sorry i will not be there to get annihilate with PRON
219,cop pull drunk driver to safety second before PRON car be hit by train via
220,PRON must be annihilate
222,boom PRON country be just entirely annihilate by a h britain
223,PRON would have be annihilate so PRON might as well thank
224,one thing for sure god have promise israel will not be annihilate but the horror of iran w nuke
225,i guess that s ok for armenian since PRON have spend most of PRON history get annihilate
226,year since PRON annihilate people instantly and become aware that PRON have the ability to annihilate the whole of humanity
227,day of tryout go good minus the fact i stop quickly to get a short ball and annihilate PRON toenail injury even more
228,during the s the oryx a symbol of the arabian peninsula be annihilate by hunter 
230,ready to get annihilate for the bucs game
231,people annihilate by last night weather really philip think PRON would have forecast that
232,domain other sophistication be annihilate closely up to the minute feat z rn f
233,i see judas priest in when rob come back scorpion as support fucking annihilate the place astonish gig
234,officially skip out on fantastic four fan t stic whatever the hash tag be PRON get annihilate in review bummer
235,thus explain why PRON be all annihilate but the few or in this case PRON the only survivor evolve and become godlike
236,just completely annihilate c ech with paul keegan what a time to be alive
237,who then be annihilate by the legion PRON the survivor of the imperfect hybrid project quickly form a new secret cell
238,exactly that s why the lesnar cena match from summerslam last year be so great because brock annihilate a guy who s
240,annihilate in damascus syrian army grind all oo sh and PRON gang into the manure pile
241,ok i be not completely forthright i may have also be in a food coma bc of the kebab tahini pickle i also annihilate w f rie
242,a fun fill happy hour at simm on bar in camden with this handsome one i get annihilate apart from this game
243,juan ny be is bol sr annihilate that ball lg m
244,hell be just a fraction of PRON belief of total annihilation destruction of usa 
245,maybe PRON should call israel and tell PRON be sorry be pre have sell PRON down the river to annihilation
246,evil dead annihilation of civilization
247,us national park services ton to national forest stop the annihilation of the salt river wild horse via
248,annihilate quarter staff of annihilation
249,world annihilation vs self transformation alien attack to exterminate human
250,star made star date planetary annihilation via
253,can PRON please sign and share this petition to save wild horse in arizona 
255,please check into salt river horse help stop the annihilation about to happen without more signatures change org thx
256,be soul punish with annihilation 
257,not to mention a major contributor to the annihilation of israel
258,PRON need help horse will die please rt amp sign petition take a stand amp be a voice for PRON gilbert
259,i reject the law of the misguided false prophet imprison nation fuel self annihilation
261,the annihilation of jeb christie amp ka sich be less than hour away please god allow PRON at least one more full day
264,hey az sign this petition to save the wild horse tanto national forest a sing along be in order
265,stop the annihilation of the salt river wild horse via
266,and PRON s the current nova in the books last i checked he be tie into the book in after rider die during annihilation
268,please sign amp rt to save salt river wild horse 
269,thanks dante do join PRON by follow the zone johnny
273,PRON be go to fight taylor as soon as i get there
274,oh h no fuku rodan i do not survive the apocalypse boku to feel horrible PRON poor boy PRON pp or child
275,will there be another jocelyn birthday apocalypse
276,rt jane nelson rt stephen scifi adaptation watch charlie human apocalypse now now option e for film science fiction
277,apocalypse please
278,another hour PRON august at pm here red rover zombie apocalypse internet radio college radi
279,i feel like PRON do a pull up be one of the stage of the apocalypse
280,PRON s kinda hot play on the radio today what s next disease to all the apocalypse have start everyone be careful
281,but if PRON the apocalypse lol gf m
282,i know PRON a question of interpretation but this be a sign of the apocalypse i call PRON
283,julie r be the apocalypse version of romeo juliet warm bodie
284,the apocalypse be upon PRON
285,rt fit t scott minecraft night lucky block mod bob apocalypse wither amp more mod showcase popular mmo s vi
286,and so PRON begin day one of the snow apocalypse
287,rt our mother mary short reading apocalypse in the spirit the angel take PRON to the top of an enormous high mountain and
288,candy lit imagine s a rumi in a zombie apocalypse fight back to back heart to heart conversation over the
289,rt zone wolf i like a video minecraft night lucky block mod bob apocalypse wither amp more mo
290,and that s because on PRON planet PRON the lone audience of the apocalypse
291,dad buy a dvd that look like a science doc on the front but i read the back and PRON actually about the impending biblical apocalypse
292,PRON be indeed if the apocalypse come this week i know where ill be
293,go look at grizzly peak right now PRON look like the beginning of an dystopian apocalypse movie
294,PRON niece just ask PRON would PRON be scare if there be an apocalypse here
295,there s a storm over cairo in the late x men apocalypse set photo via
296,minecraft night lucky block mod bob apocalypse wither amp more mod showcase popular mmo s via
297,shoot through the heart xv PRON be go to totally give love a bad name with this heart pier c 
298,rt geek apocalypse pm gmt hesse play dark souls day etc pb
299,i know where to go when the zombie take over
300,the late from reveal storm be a queen in apocalypse
301,shadow box the apocalypse
302,short reading apocalypse in the spirit the angel take PRON to the top of an enormous high mountain and
303,enjoy live action attack on titan but every time i see poster PRON be remind how freshly clean and coif everyone be in the apocalypse
304,i like a video minecraft night lucky block mod bob apocalypse wither amp more mod showcase
305,pb ban temporary a vy s s do not kill flag only fast xp for reason
306,pb ban temporary russ a ky do not kill flag only fast xp for reason
307,official vid double cups gt gt gt gt prod gt gt armageddon
308,o uv indo peace love amp armageddon
309,best movie PRON have ever see armageddon
310,bed time do not wake PRON up unless revolution or armageddon start
311,red faction armageddon microsoft xbox full read by ebay 
312,PRON already know how this shit go world series or armageddon
313,rt love true love romance li th voodoo seduction astrology r tr rt lot z apocalypse armageddon pla
314,PRON be go to beat armageddon as hsu hao just get a flawless on PRON first try
315,ben affleck i know there s a wife kid and other girl but i can not help PRON PRON have love PRON since armageddon e online chat
316,if PRON would have have a long coat to hand PRON would have wear PRON the certainty of armageddon bear a sense of occasion
317,PRON phone be spy on PRON hide back door nsa datum mining software the financial armageddon blog
318,pb ban temporary hy ider ghost do not kill flag only fast xp for reason
319,rt love true love romance li th voodoo seduction astrology r tr rt lot z apocalypse armageddon planet
320,pb ban temporary fighter dena do not kill flag only fast xp for reason
321,photo sketch i do base on the a taste of armageddon episode of star trek to s
322,armageddon
323,good luck to the tomorrow night get some coefficient point plz
325,PRON be another one for the history book thank the justice department and by the way i have not pay income tax in yrs
326,vladimir put in issue major warning but be PRON too late to escape armageddon
327,god kingdom heavenly govt will rule over all people on the earth after armageddon 
328,l b entertainment lot of bruce will is movies dvd die hard monkey armageddon sixth ebay auction
329,let talk some more about PRON go of guild s a under come right up here on stage
330,PRON niece be gain the ability to stand PRON be get prepare for toddler apocalypse armageddon
331,check out prep per doomsday must have library collection on cd s ht f prep per talk survival a prep per via
332,again e ep thought of PRON yesterday when i see that hell a scary hail armageddon
333,so the a ham ed is think the messiah have already come year ago where be armageddon where be the da j a al where be gog amp magog
334,sadly how windows reveal microsoft ethic armageddon
335,armageddon avert by el patron ultima lucha
336,if PRON have the time hour the late series about ww blueprint for armageddon be extremely impressive
337,european fit ba till christmas armageddon
338,christians unite for israel cuf i jews should convert soon or die by armageddon PRON
339,official vid gt double cups gt gt gt gt prod gt gt armageddon
340,tomorrow be the day PRON start armageddon preseason workout
341,lee do comedy work class tory prepare for PRON armageddon interest rate rise
342,chart prove financial crisis part have begin the financial armageddon economic collapse blog track tren
343,paul craig roberts vladimir put in issue major warning but be PRON too late to escape a br ics roberts russia
344,PRON be on stage now right under the light be not PRON funny where do PRON get the go of ball with which PRON staff PRON pd
345,official vid the real gt gt gt gt gt gt gt gt gt armageddon com in soon
346,well do celtic finger cross for aberdeen tomorrow night armageddon eh
347,beyonce be PRON pick for fan army bey hive 
348,one direction be PRON pick for fan army direction er 
349,second of summer be PRON pick for fan army sos fam
350,beyonce be PRON pick for fan army bey hive
353,see that army of white walker be the very first thing that have slightly intrigue PRON on get so far
354,build PRON own kingdom and lead PRON army to victory g this friend code lz kt j nox
355,salvation army host rally to reconnect father with child the salvation army be host a back to school rally
356,vote for direction er vs queen in the th round of the fan army faceoff
357,but if PRON build an army of dog and PRON leader be a lion all dog will fight like a lion
358,show PRON a hero tv review 
360,infantry mens lu me dial army analog quartz wrist watch sport blue nylon fabric full re a 
362,victor in ox swiss army date women rubber mop watch 
363,rt dr ayesha india kom unt or jaw ab do indian army ki
364,second of summer be PRON pick for fan army sos fam 
367,PRON da one mtv summer star video vera no mtv mtv hot t britney spear lana del rey
368,one direction be PRON pick for fan army direction er
369,stony jackson be americas last hope as PRON lead an army of felon thus and army reject against the army o satan 
370,wwi wwii japanese army navy military japan leather watch war mi do ww full read by ebay 
375,pot us appoints brig gen richard g kaiser as member of the mississippi river commission learn more about the mrc
376,what a violent country get the army involve to help control the killing and bring back peace to the poor people
381,two jewish terrorist charge in historic church arson the ugly truth 
382,spokane authority say PRON be struggle to solve arson case like today on hamilton 
383,thousand attend a rally organize by peace now protest the arson attack that take the life of an
